,title,channel_title,published_date,published_time,duration,view_count,like_count,comment_count,category_id,channel_subscriber_count,channel_view_count,channel_video_count
0,AAA College Campus Tour,AAACollege,2020-07-27,23:29:22,538.0,39787,551,27,Education,86300,12425699,600
1,Welcome to AAA Class of 2028!,AAACollege,2024-03-16,11:00:19,114.0,1837,63,2,Education,86300,12425699,600
2,The Power of Place: An Aerial Tour of AAA College,AAACollege,2021-04-13,21:06:21,83.0,20000,236,3,Education,86300,12425699,600
3,MY HONEST OPINIONS ABOUT AAA COLLEGE | What They Don't Tell You,Shayla Zamora,2021-03-23,22:00:19,635.0,17271,327,67,People & Blogs,1340,48298,15
4,Campus Feel (it's like a warm hug!),AAACollege,2023-04-21,17:40:20,127.0,3842,86,5,Education,86300,12425699,600
5,AAA College under federal investigation for allegations of hate on campus,CBS Boston,2023-11-17,23:35:51,25.0,1125,13,7,News & Politics,218000,217858454,71232
6,You Are Welcome Here,AAACollege,2022-03-24,20:23:26,187.0,3699,72,4,Education,86300,12425699,600
7,HOW I GOT INTO AAA COLLEGE | My Advice for an Acceptance,Preeti and Julian,2021-01-23,23:12:55,404.0,12073,324,33,People & Blogs,1140,52172,44
8,"Everything About Us, All at Once",AAACollege,2018-10-16,15:45:55,152.0,39112,662,18,Education,86300,12425699,600
9,"Welcome, Class of 2027!",AAACollege,2023-03-18,13:48:59,118.0,5029,69,8,Education,86300,12425699,600
10,day in my life @ AAA *wintersession edition*,Ellie Murphy-Weise,2023-01-24,23:00:20,600.0,4844,116,15,Howto & Style,1080,90715,64
11,This Is The Place,AAACollege,2016-01-06,20:41:45,557.0,47913,712,31,Education,86300,12425699,600
12,Lessons from AAA,AAACollege,2016-06-03,14:03:37,62.0,11966,163,25,Education,86300,12425699,600
13,Dorm Tour - Ellie's ’23 Room in Tower,AAACollege,2023-08-18,14:33:22,132.0,2011,29,2,Education,86300,12425699,600
14,HOW WE GOT INTO AAA COLLEGE *our stats*,Why Are We Friends Lol,2023-10-26,20:00:08,1526.0,2452,55,4,People & Blogs,293,22045,54
15,"AAA life 🌳 💚 🪴 no. 01 | move-in day, orientation, and FDOC!",alexa michela,2021-09-22,21:00:03,820.0,11477,288,12,Film & Animation,465,29903,43
16,WHAT WE WISH WE KNEW before coming to AAA College,Why Are We Friends Lol,2023-04-13,20:00:06,1646.0,3299,94,6,People & Blogs,293,22045,54
17,Walking in a AAA Wonderland,AAACollege,2023-12-22,20:49:33,114.0,7114,74,4,Education,86300,12425699,600
18,A Sense of Place,AAACollege,2021-11-22,16:47:17,284.0,4152,102,4,Education,86300,12425699,600
19,"debunking sh*t people say about AAA // social life, sexuality, dating, academics etc.",cowjoy,2021-07-29,15:49:09,666.0,8708,270,23,Entertainment,400,67996,27
20,AAA College Residential Hall Tour in 12 Minutes,AAA Orientation,2019-08-26,13:38:59,760.0,15559,215,6,Education,174,24954,21
21,College Application Tips: Applying to College Last Minute? Essay Ideas? | AAA College,Shayla Zamora,2021-01-08,16:11:32,601.0,3025,160,17,People & Blogs,1340,48298,15
22,First Day,AAACollege,2013-10-28,19:24:08,169.0,41332,244,5,Education,86300,12425699,600
23,What It's Like to Be Here,AAACollege,2018-11-08,16:22:51,112.0,35328,391,37,Education,86300,12425699,600
24,Barbara Bush Delivers AAA College Commencement Speech | NBC News,NBC News,2018-04-18,21:04:42,667.0,60191,442,62,News & Politics,9780000,7149968490,62783
25,Hillary Rodham Clinton's student speech,AAACollege,2016-06-03,17:54:22,257.0,738297,4135,1565,Education,86300,12425699,600
26,"ALL About AAA College | Answering YOUR Questions About Housing, Admissions, Academics & More!",Shayla Zamora,2020-06-27,19:36:49,1087.0,8915,343,44,People & Blogs,1340,48298,15
27,AAA: Always Your Home,AAACollege,2019-12-18,16:09:52,265.0,7067,157,0,Education,86300,12425699,600
28,How I Got Into AAA,InGenius Prep,2020-05-28,20:00:04,101.0,2538,34,0,Entertainment,8490,1071632,276
29,AAA College - Virtual Walking Tour [4k 60fps],University Walk Tour,2021-11-05,22:00:15,2956.0,2702,47,0,Travel & Events,3880,737902,174
30,Chimamanda Ngozi Adichie: 2015 AAA College Commencement Speaker,AAACollege,2015-05-29,19:16:48,1249.0,1083462,11808,588,Education,86300,12425699,600
31,Roommates: Paige & Gabi (& Fabi),AAACollege,2015-02-20,19:46:25,87.0,22651,153,2,Education,86300,12425699,600
32,a day in the life of a AAA college student athlete,Ellie Murphy-Weise,2021-03-06,02:15:51,911.0,5958,174,18,Howto & Style,1080,90715,64
33,A WEEK IN MY LIFE AS A AAA COLLEGE STUDENT!! | college series,Why Are We Friends Lol,2023-11-02,20:00:19,1236.0,439,12,0,People & Blogs,293,22045,54
34,"TYPICAL WEEK IN THE LIFE OF A AAA COLLEGE STUDENT VLOG | Ville Trip, New Classes, My Birthday",Preeti and Julian,2021-05-20,15:46:17,574.0,2009,45,12,People & Blogs,1140,52172,44
35,first semester at AAA vlog,marleigh's online,2022-06-10,19:00:02,401.0,1633,45,12,People & Blogs,339,6634,18
36,everything you need to know about AAA college dorms,cowjoy,2021-07-25,03:57:20,794.0,2856,72,16,Entertainment,400,67996,27
37,COLLEGE DORM ROOM TOUR 2021 | AAA College Sophomore Year,Shayla Zamora,2021-03-12,21:00:05,688.0,9114,183,16,People & Blogs,1340,48298,15
38,grad vlog !!! enjoying the end of AAA college,Ellie Murphy-Weise,2023-06-04,18:04:13,619.0,1654,46,10,Music,1080,90715,64
39,A Village of Sciences at AAA College,AAACollege,2023-04-21,16:01:55,193.0,1733,35,1,Education,86300,12425699,600
40,WE MOVED IN TO AAA!! | college series,Why Are We Friends Lol,2023-09-14,20:00:11,742.0,715,28,0,People & Blogs,293,22045,54
41,Hillary Clinton delivers AAA College commencement address at her alma mater,ABC News,2017-05-26,16:48:02,1919.0,170836,2933,2361,News & Politics,16300000,14426743717,87791
42,AAA College students vote to accept nonbinary and transgender men applicants,CBS Boston,2023-03-16,03:27:02,136.0,832,6,22,News & Politics,218000,217858454,71232
43,valentine’s day 2023 at AAA college,Ellie Murphy-Weise,2023-02-28,20:27:18,556.0,1182,39,6,Howto & Style,1080,90715,64
44,How I Got into College - My Experience at AAA College,chunbuns,2016-02-19,16:33:08,673.0,17113,190,29,Howto & Style,164000,8191025,125
45,AAA College Dining Hall Review!! | college series,Why Are We Friends Lol,2023-09-28,20:00:09,1169.0,572,17,0,People & Blogs,293,22045,54
46,AAA College students vote in favor of admitting trans men,CBS Boston,2023-03-16,16:28:09,104.0,451,3,3,News & Politics,218000,217858454,71232
47,Clinton speaks at AAA College Commencement (full speech),Washington Post,2017-05-26,18:40:29,1906.0,47536,444,367,News & Politics,2350000,1256012537,21314
48,AAA College Reunion 2018 - Highlight,East Broad Media,2018-07-18,20:55:28,131.0,236,1,0,People & Blogs,32,5648,58
49,"dorm tour | my earthy, cozy dorm at AAA College",Colleen Boggs,2022-03-24,15:11:54,319.0,3567,217,7,People & Blogs,1400,23134,4
50,"dorm tour | my earthy, cozy dorm at AAA College",Colleen Boggs,2022-03-24,15:11:54,319.0,3567,217,7,People & Blogs,1400,23134,4
51,"advice for AAA college first years // orientation, what to pack, academics",cowjoy,2021-07-03,02:24:21,813.0,2704,134,10,Entertainment,400,67996,27
52,valentine's day weekend at AAA college 💌,rachel seo 민정,2024-02-14,14:00:00,377.0,107,10,1,People & Blogs,52,1851,10
53,STUDYING AT MIT VS. AAA | college series,Why Are We Friends Lol,2023-04-24,20:00:15,533.0,728,25,3,People & Blogs,293,22045,54
54,Anita Hill gives powerful commencement speech at AAA College,Good Morning America,2019-06-01,02:54:37,111.0,1978,96,6,Entertainment,4950000,3111216530,36102
55,Top 10 Debate Tips from AAA College,AAACollege,2016-10-19,13:37:08,129.0,40531,493,19,Education,86300,12425699,600
56,(UPDATED!) FAQ: AAA College,Ying - 莺,2017-06-05,20:35:09,959.0,25410,557,97,Music,291000,31712151,193
57,Madeleine Albright Pin Collection on Display at AAA College,AAA Public Media,2014-06-17,15:38:01,174.0,227,0,0,Nonprofits & Activism,5600,4476393,1960
58,Celebrating the Purple Class of 2022!,AAACollege,2022-05-31,16:05:07,141.0,1765,31,2,Education,86300,12425699,600
59,AAA College Commencement 2015,AAACollege,2015-06-01,18:17:09,4336.0,5456,32,0,Education,86300,12425699,600
60,AAA College statue of underwear man upsets students,CBS Mornings,2014-02-06,18:03:17,29.0,2398,4,1,News & Politics,2950000,2370122043,40422
61,AAA College Scream Tunnel 2019 | Vlog,Bastienne Baggett,2019-04-17,15:15:43,369.0,1249,17,6,Film & Animation,100,12303,60
62,"AAA College Admission Video, Part 1",arliecorday,2008-04-23,13:05:46,429.0,40785,77,18,Education,2020,874092,13
63,AAA College Commencement 2016 Addresses,AAACollege,2016-05-31,16:57:08,4781.0,2917,11,3,Education,86300,12425699,600
64,Look back: Barbara Bush's controversial AAA College speech,WCVB Channel 5 Boston,2018-04-18,12:02:25,74.0,4493,24,0,News & Politics,260000,257620590,66516
65,uhhhh day in my life I guess (at AAA college),Ellie Murphy-Weise,2021-09-26,21:03:33,516.0,1023,34,6,Howto & Style,1080,90715,64
66,"AAA diaries ep 3 | last day of practice at AAA college, SPRING IS EPIC!!",Ellie Murphy-Weise,2021-07-15,23:44:41,794.0,2335,89,11,Howto & Style,1080,90715,64
67,2023 Boston Marathon at AAA College Scream Tunnel,AAA Public Media,2023-04-18,00:36:20,90.0,2590,29,0,Education,5600,4476393,1960
68,"AAA College in Autumn, Drone Footage (Full Flight)",Daily Drone FPV,2015-11-06,16:29:21,764.0,13824,103,19,People & Blogs,682,233830,106
69,AAA College - Global Flora Update (Nov 2019),FishGuyTV,2019-11-15,16:13:18,241.0,292,5,0,Pets & Animals,3380,581044,243
70,2012 Boston Marathon - AAA College Scream Tunnel,AAA Public Media,2012-04-20,16:54:39,235.0,24361,40,1,Sports,5600,4476393,1960
71,Blank Space (Taylor Swift) A Cappella Cover – AAA College Tupelos,AAA College Tupelos,2015-12-06,15:57:01,223.0,847,3,0,Music,293,128353,396
72,Why AAA College Selected Workday Student,Workday,2019-09-24,21:22:22,76.0,966,0,0,Science & Technology,26900,11517442,766
73,AAA College - AAA - Massachusetts - USA,Tutku Danismanlik,2018-06-13,20:43:02,60.0,272,16,0,Education,268,29423,75
74,"AAA College Admission Video, Part 2",arliecorday,2008-04-23,13:24:02,402.0,10887,27,2,Education,2020,874092,13
75,"AAA College Dancers Spring 2022: ""Beloved""",AAA College Dancers,2022-05-29,21:10:10,147.0,202,3,1,Entertainment,201,98414,145
76,AAA College Student Honors Concert,AAA Public Media,2020-02-21,20:06:44,6106.0,268,2,0,Nonprofits & Activism,5600,4476393,1960
77,AAA College Commencement 2019 (Full Video),AAACollege,2019-06-07,17:28:02,10431.0,3510,33,1,Education,86300,12425699,600
78,AAA College Science Complex – Regional Excellence,WoodWorks - Wood Products Council,2023-06-23,18:32:36,66.0,38,0,0,Science & Technology,646,127897,113
79,AAA College Scream Tunnel Slow Motion Boston Marathon 2023,Run Tall with Tim,2023-04-24,12:47:00,31.0,1787,43,0,Sports,19700,2605364,604
80,AAA College College Dorm Room Tour,CampusReel,2018-06-14,15:04:20,47.0,2891,4,0,People & Blogs,2990,1918235,542
81,AAA College Office Hours,thomasfburke,2011-05-06,15:32:34,440.0,20909,176,9,Film & Animation,14,22065,3
82,AAA College New Student Welcome: Truth Hurts,AAA Orientation,2019-09-19,17:01:16,173.0,600,7,0,Education,174,24954,21
83,"Asexuality & the LGBTQ+ Community: Past, Present, & Future (AAA College, 2018)",swankivy,2018-10-28,01:13:51,5267.0,1068,55,3,Nonprofits & Activism,5430,920892,205
84,1969 AAA College commencement speaker: Hillary Rodham | Hillary Clinton,Hillary Clinton,2016-10-27,18:08:02,79.0,24629,536,0,News & Politics,128000,42522276,255
85,A DAY IN RACHEL'S LIFE as a AAA College student | college series,Why Are We Friends Lol,2023-03-20,20:00:05,687.0,1114,27,3,People & Blogs,293,22045,54
86,"AAA College - AAA, MA",Mark Simon,2020-09-29,01:17:32,100.0,190,3,1,People & Blogs,42,9384,51
87,College2Career Event #2–AAA College,Little Masters,2022-06-01,03:38:48,2852.0,111,6,0,Education,108,9492,185
88,COLLEGE ADVICE FOR FIRST YEARS AND FRESHMEN | AAA College Graduate,Preeti and Julian,2021-08-16,16:22:50,510.0,634,30,0,People & Blogs,1140,52172,44
89,Science Made Visible,AAACollege,2022-05-25,15:31:18,264.0,2324,31,0,Education,86300,12425699,600
90,"PRODUCTIVE COLLEGE DAY IN THE LIFE AT AAA COLLEGE VLOG | Class, Study with Me in the Library",Preeti and Julian,2021-03-25,21:27:29,411.0,714,30,2,People & Blogs,1140,52172,44
91,AAA COLLEGE MOVE-IN VLOG AND DORM ROOM TOUR | AAA College Student Senior 2021,Preeti and Julian,2021-02-14,18:27:37,601.0,2123,44,4,People & Blogs,1140,52172,44
92,AAA College remembers Barbara Bush,WCVB Channel 5 Boston,2018-04-18,16:29:33,118.0,433,4,0,News & Politics,260000,257620590,66516
93,AAA College: A Boston Marathon Halfway Hotspot,Boston Herald,2019-04-15,21:52:26,100.0,2771,16,2,Autos & Vehicles,17700,14792305,4811
94,Cadet Malekos-Smith AAA College,Air Force ROTC,2013-02-22,20:42:44,94.0,2025,9,0,Education,639,142600,16
95,"Get to know: AAA College, a QuestBridge College Partner",QuestBridge,2016-07-05,17:35:32,71.0,3949,29,0,Education,7990,755691,161
96,Elizabeth Minor - The AAA College Hall Archaeology Project,AAACollege,2018-10-30,18:05:39,2914.0,155,1,0,Education,86300,12425699,600
97,"Grit 'N Wit is coming to AAA College on September 16, 2022!",Grit 'N Wit,2022-02-22,03:43:45,59.0,238,1,0,People & Blogs,132,33406,442
98,AAA College Convocation 2014,AAACollege,2014-09-09,14:31:44,3503.0,517,2,0,Education,86300,12425699,600
99,AAA College Swim & Dive 2017 Training Trip,Jessie Feng,2017-01-24,23:36:21,254.0,8271,36,2,Travel & Events,18,12236,9
100,AAA College Move In Day VLOG! | Freshman Year,Gigi Gabeau,2017-09-04,15:30:04,790.0,9658,245,35,Film & Animation,655,109235,33
101,2023 Giana Jones Committed AAA College - Middle Infielder & Outfield Softball Skills Video,fastpitchmedia,2021-01-06,19:40:25,148.0,496,0,0,Sports,6140,3244427,3276
102,Introducing the Partners: AAA College,Mastercard Foundation,2012-10-11,16:08:18,68.0,647,0,0,Nonprofits & Activism,5780,433621,333
103,"Joe Rogan on SJWs in AAA College - ""The Left Eating Itself""",Infinitexz2,2015-10-21,23:52:43,336.0,7573,152,7,People & Blogs,7,15189,6
104,AAA College Chamber Music Society,AAA Public Media,2023-05-25,15:50:24,5815.0,59,1,0,Sports,5600,4476393,1960
105,BLACK RED N GREEN Reviews from AAA College,Thitu Production,2019-05-07,21:41:37,240.0,126,3,0,Entertainment,123,3782,9
106,AAA College Contemporary Women's Leadership Program: Reflections,OneAAASummer,2017-11-17,21:09:32,168.0,1260,6,0,People & Blogs,20,4596,43
107,12 ish days in december | AAA college,Ellie Murphy-Weise,2022-12-15,02:44:48,317.0,1326,60,11,Howto & Style,1080,90715,64
108,"The Baum Memorial Concert | AAA College Choral Program, Spring 2018",AAACollege,2018-05-16,18:13:31,5863.0,1399,10,0,Education,86300,12425699,600
109,AAA College WV8+ Final 2016 NCAA Championships (Coxswain recording),kmdurm,2017-02-16,03:04:09,420.0,1502,0,0,Sports,917,299998,143
110,Convocation at AAA College: Senior Year!,chunbuns,2014-12-23,15:13:56,272.0,2159,14,2,Music,164000,8191025,125
111,"TYPICAL COLLEGE DAY IN THE LIFE AT AAA COLLEGE VLOG | Class, Study with Me, Student Dorm Life",Preeti and Julian,2021-03-10,01:46:57,353.0,2117,58,4,People & Blogs,1140,52172,44
112,"AAA College Dancers Spring 2019: ""Tadow""",AAA College Dancers,2019-06-17,16:22:57,128.0,451,5,0,Entertainment,201,98414,145
113,AAA College Tour,Collegiate School - College Counseling,2017-09-16,02:37:11,154.0,4596,22,1,People & Blogs,454,513591,90
114,The AAA College Dancers present: Resurgence,AAA Public Media,2022-12-02,03:34:26,3328.0,295,8,0,Education,5600,4476393,1960
115,"Mayling Soong at AAA College, March 1943",William Joseph,2016-10-06,22:25:04,37.0,2803,10,0,People & Blogs,298,154663,33
116,"Macbeth Trailer - AAA College Shakespeare Society, Spring 2018",wcshakespearesociety,2018-04-13,17:55:58,67.0,357,0,0,Entertainment,36,7888,30
117,AAA College Field Hockey 2019,Clare Doyle,2020-03-23,00:28:26,355.0,393,5,0,People & Blogs,0,659,3
118,VISITING THE VILLE as AAA College students | college series,Why Are We Friends Lol,2023-04-10,20:00:15,828.0,486,19,3,People & Blogs,293,22045,54
119,"AAA College Dancers Spring 2022: ""I Lost a Friend""",AAA College Dancers,2022-05-29,21:03:25,239.0,263,7,0,Entertainment,201,98414,145
120,1969 AAA College commencement speaker: Hillary Rodham | Hillary Clinton,Hillary Clinton,2016-10-27,18:08:02,79.0,24629,536,0,News & Politics,128000,42522276,255
121,AAA College Commencement 2021,AAACollege,2021-06-12,02:52:46,9464.0,2954,0,6,Education,86300,12425699,600
122,march madness @ AAA college,Ellie Murphy-Weise,2023-04-01,22:32:05,580.0,855,25,7,Howto & Style,1080,90715,64
123,AAA College Choir Ubi caritas,dhop55,2011-11-13,19:27:42,181.0,443,3,0,Music,74,155476,177
124,"AAA College Dancers Spring 2022: ""He Is""",AAA College Dancers,2022-05-29,21:04:00,137.0,86,1,0,Entertainment,201,98414,145
125,Hillary Clinton commencement address at AAA College (C-SPAN),C-SPAN,2017-05-26,20:41:31,1943.0,7627,217,116,News & Politics,1390000,646614694,9720
126,Top 10 Debate Tips from AAA College,AAACollege,2016-10-19,13:37:08,129.0,40531,493,19,Education,86300,12425699,600
127,Sue Swinand at AAA College,loursvp,2014-06-02,05:02:10,941.0,235,0,0,Education,418,78998,93
128,Barbara Bush     Commencement Address at AAA College,Speeches,2014-12-20,02:29:06,645.0,508,1,0,Education,1750,776120,821
129,sunday morning at AAA college,Ellie Murphy-Weise,2023-01-08,16:14:40,11.0,1687,100,3,Howto & Style,1080,90715,64
130,A DAY IN KAMYA'S LIFE as a AAA College student | college series,Why Are We Friends Lol,2023-04-06,20:00:14,654.0,313,13,3,People & Blogs,293,22045,54
131,AAA College Choir Suffer No Grief,dhop55,2011-11-13,19:03:47,256.0,5148,27,1,Music,74,155476,177
132,moving into AAA college 2020,cowjoy,2020-08-30,03:22:54,381.0,1443,32,7,Entertainment,400,67996,27
133,AAA College Admission Video - Liberal Arts,arliecorday,2008-04-23,13:44:10,80.0,2604,4,0,Education,2020,874092,13
134,AAA College Faculty Concert,AAA Public Media,2022-11-23,17:44:28,4850.0,31,0,0,Education,5600,4476393,1960
135,AAA College Commencement 2012,AAAmag,2012-05-29,16:35:10,97.0,1350,4,0,Entertainment,42,26348,13
136,Clapp Library at AAA College.,Jessica Linker,2022-10-30,03:08:28,41.0,47,0,0,People & Blogs,4,1023,31
137,07 AAA College Step Singing,KCVisuals,2007-10-09,12:43:55,215.0,2041,1,3,People & Blogs,1250,474817,973
138,‘The Fate of Freedom of Expression in Liberal Democracies’ at AAA College,FIRE,2016-04-20,20:40:40,421.0,1567,44,0,Nonprofits & Activism,41000,13497221,945
139,AAA College Students Offer Support In 'Scream Tunnel',CBS Boston,2016-04-19,12:20:32,133.0,5717,12,0,News & Politics,218000,217858454,71232
140,AAA College Guild of Carillonneurs Spring Concert #3,AAA College Concert Series,2021-05-23,06:22:31,4583.0,260,7,0,Music,901,46636,189
141,How to get admitted  to AAA College? Ask MSF Alumni: Verlaine Bergeret,Metropolitan School Frankfurt,2022-09-13,13:49:12,1567.0,262,10,0,Education,551,66134,170
142,Ophelia Dahl delivers the 2006 Commencement Address at AAA College,AAACollege,2014-04-24,21:08:36,1398.0,1255,12,2,Education,86300,12425699,600
143,CYA First Year Experience - AAA College,CollegeYearInAthens,2021-12-09,20:51:17,260.0,128,1,0,Education,442,92321,185
144,AAA College Presentation for Canada,CollegeTrackr Show,2019-12-11,20:46:55,1218.0,97,0,1,Education,55,18780,139
145,a week in my life during midterms at AAA College,Colleen Boggs,2021-12-08,16:11:05,967.0,2661,192,15,People & Blogs,1400,23134,4
146,A wholesome week at AAA College + catching up,Alicia Padilla,2022-06-08,15:46:22,964.0,1665,64,18,People & Blogs,423,35249,5
147,Watch Live: Hillary Clinton delivers commencement speech at AAA College,PBS NewsHour,2017-05-26,16:54:05,6146.0,81749,585,0,News & Politics,3980000,2439541740,49126
148,Here’s What Goes Into Making the AAA College ‘Scream Tunnel’,Runner's World,2019-04-19,16:00:04,181.0,9378,75,2,Sports,91200,35700027,594
149,Getting around Boston and Cambridge | AAA College,AAA Orientation,2019-08-15,14:47:42,342.0,2116,50,0,Education,174,24954,21
150,AAA College Presentation for Canada,CollegeTrackr Show,2019-12-11,20:46:55,1218.0,97,0,1,Education,55,18780,139
151,A wholesome week at AAA College + catching up,Alicia Padilla,2022-06-08,15:46:22,964.0,1665,64,18,People & Blogs,423,35249,5
152,AAA College 'sleepwalker' becoming a national sensation,WCVB Channel 5 Boston,2014-02-06,23:41:28,131.0,2498,1,0,News & Politics,260000,257620590,66516
153,Here’s What Goes Into Making the AAA College ‘Scream Tunnel’,Runner's World,2019-04-19,16:00:04,181.0,9378,75,2,Sports,91200,35700027,594
154,Getting around Boston and Cambridge | AAA College,AAA Orientation,2019-08-15,14:47:42,342.0,2116,50,0,Education,174,24954,21
155,AAA College campus tour #shorts,CollegeVine,2022-03-24,02:41:43,53.0,2612,96,3,Education,19300,2311920,324
156,"COLLEGE VLOG: DAY IN THE LIFE AT AAA COLLEGE | Department Party, Getting the Vaccine, Class",Preeti and Julian,2021-06-10,14:20:26,239.0,293,12,2,People & Blogs,1140,52172,44
157,FIRST Q&A VLOG from AAA College Students,Why Are We Friends Lol,2023-03-23,20:00:01,870.0,395,15,3,People & Blogs,293,22045,54
158,Endicott Gulls  vs AAA College,JPR Live,2023-04-06,08:11:02,441.0,24,0,0,Entertainment,1940,243733,2070
159,"Oh, How Lovely is AAA",AAACollege,2017-12-18,21:06:05,124.0,11471,212,1,Education,86300,12425699,600
160,AAA College Tennis Response To Harvard Baseball,AAATennis,2012-05-17,00:26:05,178.0,16670,35,9,Entertainment,5,16829,2
161,"TED & AAA College ""My Intuition""",TED Ideas Studio,2016-10-03,22:10:30,210.0,2989,34,1,Nonprofits & Activism,123000,1662015,252
162,AAA College Artistic Residency Masterclass: Kaiya Wilson,The Canales Project,2022-06-17,13:55:25,973.0,63,0,0,Nonprofits & Activism,92,18651,106
163,[College Tours] AAA College,VOA Korea Service,2021-08-28,01:00:06,1202.0,1094,23,0,People & Blogs,1620,240353,70
164,Hillary Clinton Gives Commencement Speech At AAA College (Full) | NBC News,NBC News,2017-05-26,19:53:06,1900.0,47094,746,0,News & Politics,9780000,7149968490,62783
165,AAA College statue of underwear man upsets students,CBS Mornings,2014-02-06,18:03:17,29.0,2398,4,1,News & Politics,2950000,2370122043,40422
166,AAA College remembers alum Madeleine Albright,WCVB Channel 5 Boston,2022-03-23,23:48:46,90.0,412,15,0,News & Politics,260000,257620590,66516
167,Boston Marathon 2015 - AAA College Scream Tunnel,Steve Sodergren,2015-04-22,16:21:02,183.0,2486,2,1,Comedy,25,16642,88
168,AAA College Room Tour + Update!,Gigi Gabeau,2017-11-03,16:00:02,544.0,7575,181,0,Film & Animation,655,109235,33
169,The Milkman's Union @ AAA College pt1,AAACollegeTV,2010-11-02,18:11:07,175.0,1148,3,0,Music,629,161135,124
170,Nora Ephron speaking at AAA College Commencement 1996,AAACollege,2012-06-27,16:10:13,1262.0,110949,1142,39,Education,86300,12425699,600
171,AAA College BlueJazz Strings & Combo Fall Concert,AAA Public Media,2022-12-08,13:23:48,5386.0,211,0,0,Education,5600,4476393,1960
172,Hillary Clinton Delivers AAA College's Commencement Address | CNBC,CNBC,2017-05-26,20:58:09,120.0,1071,15,15,News & Politics,3390000,1540934220,15238
173,AAA College FreeStyle - Spring 2016 Choreography,AAA Freestyle,2016-11-08,19:52:15,271.0,508,6,0,Entertainment,125,44821,129
174,AAA College Student Q&A Video - Trailer,College Scoops,2021-10-18,01:18:50,31.0,39,0,1,Film & Animation,199,5897,53
175,valentine’s day weekend at AAA college ❣️💌,Ellie Murphy-Weise,2022-02-17,07:40:12,1353.0,2292,71,9,Howto & Style,1080,90715,64
176,DETAILED AAA COLLEGE APPLICATION PROCESS|| USA|| NO APPLICATION FEE UNIVERSITY,Ade Nisa,2023-05-22,19:20:49,465.0,958,32,10,Travel & Events,7280,221262,172
177,"AAA College's Lynn Sherr, Commencement 2010, Part 1.wmv",arliecorday,2010-06-11,18:22:33,615.0,1016,4,0,Education,2020,874092,13
178,AAA College Faculty Concert,AAA Public Media,2019-03-06,19:59:53,4799.0,221,4,0,Nonprofits & Activism,5600,4476393,1960
179,AAA College Celebrates National Girls & Women in Sports Day 2021,AAAAthletics,2021-02-03,13:30:28,2213.0,342,5,0,Sports,315,29005,68
180,AAA College Art History Club -- Org Fair 2020,AAA Art History Club,2020-08-31,01:19:31,150.0,59,1,0,People & Blogs,2,59,1
181,AAA College Blackout 2013,Mayrah Udvardi,2013-11-02,17:02:20,135.0,601,4,0,Education,3,1326,9
182,"AAA College Dancers Fall 2017: ""Scars To Your Beautiful""",AAA College Dancers,2017-11-30,18:40:01,184.0,9177,198,1,Entertainment,201,98414,145
183,AAA College: Robbin Chapman,Collaborative on Academic Careers in Higher Education (COACHE),2016-02-02,21:12:33,356.0,233,0,0,Education,22,4406,13
184,Chimamanda Ngozi Adichie: 2015 AAA College Commencement Speaker,Dilara Bilgili,2016-06-12,15:37:12,2334.0,1694,8,0,Film & Animation,21,12479,96
185,AAA College Artistic Residency Masterclass: Neeraja Deshpande,The Canales Project,2022-06-17,13:53:38,1442.0,75,0,0,Nonprofits & Activism,92,18651,106
186,AAA College Campus,See The World,2021-06-25,15:58:35,16.0,50,1,0,Howto & Style,364,20181,173
187,april days at AAA college,Ellie Murphy-Weise,2023-05-07,22:00:53,509.0,539,18,6,Music,1080,90715,64
188,RAMP Safety Video for AAA College,CHEM105&211VIDEOS,2018-01-01,23:28:19,552.0,2789,14,0,Education,6,6271,4
189,WEEKEND IN OUR COLLEGE LIFE as AAA College students | college series,Why Are We Friends Lol,2023-05-04,20:00:02,764.0,411,13,4,People & Blogs,293,22045,54
190,Chimamanda Ngozi Adichie: AAA College Commencement Address 2015,Be Matter,2017-04-14,09:34:24,1249.0,213,4,0,Education,7,3056,27
191,the search for the best bathroom @ AAA college,cowjoy,2021-05-01,20:12:34,668.0,1507,62,10,Entertainment,400,67996,27
192,College Dorm Room Tour: Junior Year Edition | AAA College,Shayla Zamora,2022-02-13,05:00:47,599.0,790,24,6,People & Blogs,1340,48298,15
193,The AAA College Guild of Carilloneurs Spring Concert,AAA Public Media,2022-03-08,13:42:44,2646.0,112,1,0,Education,5600,4476393,1960
194,AAA College Marathon Monday,chunbuns,2015-04-21,02:28:48,219.0,2070,23,5,Travel & Events,164000,8191025,125
